Stress_Level,Recommendations,Rating 
high,"Do the 4-7-8 Breathing Technique, where you take a comfortable seated position and relax your shoulders. Close your eyes if it helps you focus. Begin by inhaling slowly through your nose for 4 seconds, allowing your lungs to fill gently with air. After the inhale, hold your breath for 7 seconds, keeping your body as relaxed as possible. Then, exhale fully and slowly through your mouth for 8 seconds, releasing tension with each breath.",
high,"Take a moment to listen to calming audio that can help settle your mind and reduce stress. You may choose ambient soundscapes, such as rainfall, ocean waves, forest ambience, or slow-tempo classical music pieces with gentle melodies and minimal rhythmic intensity to soothe your auditory senses and lower heart rate.",
high,"Take a moment to drink a glass of water to help rehydrate your body, as stress can quietly drain your energy and disrupt normal bodily functions. Proper hydration supports clearer thinking, steadier emotions, and improved physical well-being. Pair this with a nutritious snack or meal, such as fruits, whole grains, or protein-rich foods, to replenish essential nutrients that may be depleted during stressful moments. Eating nourishing food helps stabilize blood sugar levels, boosts energy, and promotes a more balanced mood.",
high,"Find a comfortable position and gently close your eyes. Begin a short 5-minute guided imagery session to help calm your mind and release tension. As you listen, allow yourself to visualize a peaceful and safe place such as a quiet forest or any environment that brings you comfort. Imagine the details vividly, the sound of rustling leaves, the scent of pine in the air, the cool breeze brushing against your skin. use all of your senses to make the scene feel as real as possible. The more immersive the visualization, the more effectively it can lower stress, slow your breathing, and create a deep sense of inner calm.",
high,"Take a blank sheet of paper and give yourself a few minutes to write down every worry, task, thought, or concern that is currently occupying your mind. Do not judge, organize, or filter anything simply let your thoughts flow freely onto the page. This process helps release mental pressure by transferring the clutter in your mind into a physical form.",
high,"Sit comfortably in a chair. Begin by gently lowering your chin toward your chest, allowing the back of your neck to stretch as you breathe slowly. Feel the tension melt away with each inhale and exhale.",
high,"Follow a 10-minute beginner-friendly yoga video, focusing on foundational and restful poses. Find a quiet space, wear comfortable clothing, and move at your own pace. Pay attention to your breathing as you flow through each pose, allowing your body to relax fully with every stretch. ",
high,"Take a very slow 5-minute walk in a safe and comfortable space. As you move, focus on the physical sensation of each step, noticing how your feet connect with the ground and how your body shifts with every movement. Breathe naturally and pay attention to your surroundings, allowing yourself to be fully present in the moment. ",
medium,"Do the Box Breathing Technique to help you regain calm and clarity. To begin, inhale slowly through your nose for four counts, letting your lungs fill gently and evenly. Hold your breath for another four counts to stabilize your breathing rhythm. Then exhale softly through your mouth for for counts, allowing the tension to release with each breath out. Once your lungs are empty, try to hold for another four counts before starting the next cycle. Continue this 4-4-4-4 pattern for about 2 minutes to help regulate your breathing and reduce stress effectively.",
medium,"Put on a playlist of instrumental lo-fi, classical, or upbeat music to improve focus and mood. Find a comfortable place where you can settle in, and choose a genre that can help you feel calm and motivates you. Instrumental tracks are especially helpful for minimizing distractions and creating a steady background atmosphere. Allow the music to play softly as you continue what you are doing. Let the rhythm of the music guide your attention and ease any tension.",
medium,"Sit quietly for 5-10 minutes and allow yourself to settle into a calm and comfortable position. Focus your attention on your breathing. If your mind begins to wander, gently guide your focus back to your breathin without judgement. Continue maintaining this awareness to help quiet mental noise and reduce stress.",
medium,"Drink a full glass of water and eat a small, healthy snack to help stabilize your energy and support your overall well-being. Choose something light and nourishing, such as fruit, nuts, or yogurt, to give your body a quick boost without feeling heavy. Staying hydrated and properly fueled can improve your mood, sharpen your focus, and help your body respond better to stress.",
medium,"Visualize a calm place, such as quiet garden, to help your mind and body. Engage all your senses by imagining the sights, sounds, smells, and even the gentle breeze of your peaceful spot. Focus on these details to deepen your sense of calm and take a mental break from stress. Use this visualization exercise to refresh your mind and feel more relaxed and centered.",
medium,"Spend time on a creative hooby, such as drawing, playing an instrument, or an activity that lets you express yourself. Choose something you enjoy and can focus on fully, allowing your mind to take a break from stress. Engaging in creative activities can boost your mood, improve focus, and provide a healthy outlet for emotions. Use this time to recharge, have fun, and nurture your well-being.",
medium,"Perform 5 minutes of gentle neck rolls, shoulder shrugs, and side stretches to help release physical tension caused by stress. Begin with slow neck rolls by tilting your head forward, then gently rolling it in a circle to the right and back, and then to the left. Follow it with a shoulder shrugs by lifting both shoulders up toward your ears, holding for a moment, and then releasing them down slowly. Finally, do side stretches by raising one arm overhead and leaning gently to the opposite side, then switching sides. Move slowly and mindfully throuhout, focusing on relaxing your muscles as you stretch.",
medium,"Follow a 10-15 minutes beginner-friendly yoga video and focus on simple poses that you can do comfortably. Find a quiet space, wear something suitable for doing yoga, and move at your own pace. Pay attention to your breathing as you flow through each pose, allowing your mind and body to relax.",
medium,"Walk for 15 minutes to get your body moving and burn off stress hormones. Choose a safe and comfortable route, whether around your home, school, or nearby park, and walk at a pace that will help you fell relaxed and energized. Focus on your surroundings and your breathing as you move to clear your mind.",
low,"Keep up the good work! Your consistent effort and healthy habits show great self-discipline. Continue staying mindful of your routines, and take pride in the progress you’re making each day.",
low,"You're in a good state right now. Continue taking care of yourself the same way, and keep practicing the habits that help you stay balanced and steady. Your consistent choices are supporting your well-being, so stay mindful and keep going.",
low,"Stay mindful and keep practicing the habits that help you feel calm and balanced. Focus on small, consistent actions that support your well-being, and allow yourself to notice the positive effects they bring to your body and mind.",
low,"Continue following your positive routines, as they play an important role in supporting your calmness and mental balance. By practicing these habits consistently, you strengthen your ability to stay focused and maintain clarity throughout the day. Keep dedicating time to these routines, and you’ll continue to experience a steady sense of well-being, confidence, and control over your thoughts and actions.",
low,"Your efforts are paying off! Keep following the practices that help you feel balanced, grounded, and in control of your day. By consistently nurturing these positive habits, you reinforce your calm and steady mindset, making it easier to stay focused, centered, and resilient. Continue dedicating time to these routines, and notice how they support your overall well-being and sense of inner stability.",
